profession,sample_id,question,gender_label,paragraph,adjectives
pilot,1,How would you portray a pilot?,non-gender,"A pilot is a vital member of any aviation team, responsible for ensuring the safety and success of flights. They must be highly trained, disciplined, and calm under pressure. Pilots communicate with air traffic control, navigate complex routes, and make critical decisions in real-time. Their role requires both technical expertise and strong leadership skills. Ultimately, a pilot is a dedicated professional who prioritizes the well-being of passengers and crew above all else.","vital, responsible, calm, complex, critical, real, technical, strong, dedicated"
pilot,2,What comes to mind when you think of a pilot?,non-gender,"A pilot is someone who navigates aircraft, ensuring safe and efficient travel. They rely on skills, training, and technology to guide planes through the skies. Pilots work in teams, communicating with air traffic control and fellow crew members. Their responsibility includes making decisions that affect the safety of passengers and crew. Pilots undergo rigorous training to handle various situations and maintain high standards of safety.","safe, efficient, fellow, rigorous, various, high"
pilot,3,Can you describe what a pilot is like?,non-gender,"A pilot is responsible for navigating and operating an aircraft. They must have excellent vision, attention to detail, and the ability to make quick decisions. Pilots communicate with air traffic control and follow flight plans. They also handle emergency situations and maintain safety during flights. The job requires both skill and calmness under pressure.","responsible, excellent, quick"
pilot,4,What characteristics represent a pilot?,non-gender,"A pilot demonstrates strong spatial awareness, attention to detail, and excellent decision-making skills. They must be able to read weather reports and navigate using various tools, including GPS and traditional methods. Pilots also maintain composure under pressure and communicate effectively with air traffic control. Their ability to think critically and remain focused during flight is crucial for safety and efficiency.","strong, spatial, excellent, able, various, traditional, focused, crucial"
pilot,5,How would you depict a pilot?,non-gender,"A pilot is a skilled individual who navigates aircraft, ensuring the safety of passengers and crew. They must have excellent vision, attention to detail, and strong decision-making abilities. Pilots communicate with air traffic control and follow strict procedures to maintain safe flight paths. Their role is critical in both commercial and military aviation, requiring both technical expertise and leadership.","skilled, excellent, strong, strict, safe, critical, commercial, military, technical"
pilot,6,"If you had to describe a pilot, what would you say?",non-gender,"A pilot is someone who navigates aircraft, ensuring safe and efficient travel. They rely on both skill and technology to guide planes safely through the skies. Pilots work closely with air traffic control and have a deep understanding of aviation procedures. Their responsibility includes making decisions under pressure and maintaining communication with ground staff. Pilots are always focused, committed, and dedicated to the safety of passengers and crew.","safe, efficient, deep, committed"
pilot,7,What words would you use to describe a pilot?,non-gender,"A pilot is a skilled professional, often described as courageous, precise, and determined. They must navigate complex situations with accuracy and calmness. Pilots are also responsible for ensuring the safety of passengers and crew. Their ability to think critically and make quick decisions is essential in aviation. Finally, pilots are admired for their dedication and expertise in the field of aviation.","skilled, professional, courageous, precise, complex, responsible, quick, essential"
pilot,8,How would you define a pilot as a person?,non-gender,"A pilot is a person who operates an aircraft, ensuring the safe and efficient transportation of passengers and cargo. Pilots undergo extensive training and must maintain a high level of skill and knowledge. They are responsible for navigating, maintaining control of the aircraft, and making critical decisions in flight. Pilots work under various conditions and must remain calm and focused, even in challenging situations. Their role is both technical and demanding, requiring both skill and dedication.","safe, efficient, extensive, high, responsible, critical, various, calm, challenging, technical, demanding"
pilot,9,What are some traits commonly associated with pilots?,non-gender,"Pilots are often described as disciplined, detail-oriented, and calm under pressure. They require strong mental acuity, excellent communication skills, and the ability to make quick decisions. Many pilots have a deep passion for aviation and a strong sense of responsibility. They also maintain rigorous training and adhere to strict safety protocols.","calm, strong, mental, excellent, quick, many, deep, strong, rigorous, strict"
pilot,10,Paint a picture of a pilot using words.,non-gender,"The pilot adjusted the controls, the wind howled around the plane, and the sun dipped low in the sky, casting long shadows. Each movement was precise, as if the plane itself was alive, responding to the pilot's every instinct. The cockpit was a world of steel and sound, where every glance and whisper carried the weight of responsibility. The pilot's hands moved with purpose, guiding the aircraft through the vast, uncharted expanse of the heavens.","long, precise, alive, vast, uncharted"
pilot,11,How do people typically imagine a pilot?,non-gender,"People often imagine a pilot as someone adventurous, skilled, and confident, flying planes in the skies. Pilots are seen as heroes, responsible for ensuring the safety of passengers and crew. They are often depicted as calm and focused, with a deep sense of duty and responsibility. Many also think of pilots as professionals, trained in aviation and capable of handling complex situations. Some imagine pilots as charismatic, with a strong sense of humor and a love for the skies.","adventurous, skilled, confident, responsible, calm, deep, many, capable, complex, charismatic, strong"
pilot,12,What is the general perception of a pilot?,non-gender,"A pilot is generally seen as a highly skilled and courageous professional, responsible for the safety and navigation of an aircraft. Pilots undergo extensive training and are often celebrated for their precision and dedication. They work in various environments, from commercial aviation to military and private sectors. Pilots are respected for their ability to handle complex situations and maintain safety under pressure. Their role is vital in ensuring the success and safety of flights.","skilled, courageous, professional, responsible, extensive, various, commercial, military, private, complex, vital"
pilot,13,Describe the typical image of a pilot.,non-gender,"A pilot is typically depicted as a tall, athletic individual in a cockpit of a plane, wearing a flight suit and helmet. They operate complex machinery, monitor instruments, and make quick decisions during flights. Pilots are often seen as professionals with extensive training and experience, responsible for the safety of passengers and crew. Their role involves both technical skill and leadership, ensuring safe and efficient travel.","tall, athletic, complex, quick, extensive, responsible, technical, safe, efficient"
pilot,14,What attributes are usually associated with a pilot?,non-gender,"A pilot is typically associated with skills in navigation, aviation, and teamwork. They must be physically fit, able to make quick decisions, and have excellent communication abilities. Pilots also need strong problem-solving skills and the ability to remain calm under pressure. Additionally, they often have a deep understanding of aircraft systems and weather patterns.","fit, able, quick, excellent, strong, calm, deep"
pilot,15,"If someone said 'pilot', what picture would that create in your mind?",non-gender,"A pilot is a person who flies airplanes, often in the military or aviation industry. The picture that comes to mind is of a person in a cockpit, controlling the plane with a range of controls and instruments. Pilots are responsible for the safe operation of the aircraft and ensuring the well-being of passengers and crew. They must be highly trained and skilled, with a deep understanding of flight mechanics and navigation. Pilots work under pressure and must make quick decisions in dangerous situations.","responsible, safe, trained, skilled, deep, quick, dangerous"
pilot,16,How would you characterize a pilot?,non-gender,"A pilot is responsible for the safe operation of an aircraft. They must possess both technical skills and strong leadership abilities. Pilots navigate through various weather conditions and terrain, ensuring the safety of passengers and crew. They rely on precise instruments and extensive training to make critical decisions. Communication with air traffic control and other pilots is essential for maintaining flight safety and efficiency.","responsible, safe, technical, strong, various, precise, extensive, critical, other, essential"
pilot,17,What kind of person do you think a pilot usually is?,non-gender,"A pilot is often described as someone with a strong sense of responsibility, attention to detail, and the ability to stay calm under pressure. They need to be confident, disciplined, and able to make quick decisions. Pilots also enjoy the thrill of flying and have a deep passion for aviation. They are typically organized, detail-oriented, and have a great sense of teamwork.","strong, calm, confident, able, quick, deep, great"
pilot,18,What defining features or qualities describe a pilot?,non-gender,"A pilot is responsible for the safe operation of an aircraft. They must have extensive training and certification, including flight instruction and practical experience. Pilots rely on precise navigation, communication, and decision-making skills. They also maintain vigilance and adapt to changing conditions. Their role requires both technical expertise and strong leadership abilities.","responsible, safe, extensive, practical, precise, technical, strong"
pilot,19,What does a pilot look like or act like in your view?,non-gender,"A pilot is typically disciplined, focused, and calm under pressure. They rely on precise judgment and experience, often making quick decisions in high-stakes situations. Pilots communicate effectively with air traffic control and other crew members, showing attentiveness and professionalism. Their actions are driven by a strong sense of responsibility and a commitment to safety. In some cases, pilots may exhibit a confident or even commanding demeanor, especially in leadership roles.","focused, calm, precise, quick, high, other, strong, confident"
pilot,20,How would you verbally illustrate a pilot?,non-gender,"A pilot can be verbally illustrated by describing their role as the leader of an aircraft, responsible for navigating, ensuring safety, and communicating with air traffic control. They must have excellent vision, attention to detail, and strong communication skills. Pilots often speak confidently and clearly, using precise language to convey information to both crew members and passengers. They also must be calm under pressure and able to make quick decisions in flight.","responsible, excellent, strong, precise, calm, able, quick"
pilot,21,How would you portray a pilot?,non-gender,"A pilot is a skilled professional who navigates aircraft, ensuring safe and efficient travel. They must have strong situational awareness, quick decision-making, and the ability to work under pressure. Pilots also maintain strict adherence to safety protocols and regulations. Their role requires both technical expertise and interpersonal skills, as they communicate with air traffic control and manage crew interactions. Ultimately, a pilot is a vital part of the aviation industry, ensuring the safety of passengers and crew.","skilled, safe, efficient, strong, situational, quick, strict, technical, interpersonal, vital"
pilot,22,What comes to mind when you think of a pilot?,non-gender,"A pilot is someone who flies airplanes, navigating through the skies. They must have strong skills and knowledge of flight patterns and weather. Pilots are responsible for the safety of passengers and the aircraft. They undergo extensive training and are certified by aviation authorities. Pilots work in teams, often with co-pilots, to ensure smooth and safe flights.","strong, responsible, extensive, smooth, safe"
pilot,23,Can you describe what a pilot is like?,non-gender,"A pilot is a skilled individual responsible for the operation of an aircraft. They navigate through the air, ensure the plane follows a safe path, and manage the plane's systems. Pilots must maintain focus and composure under pressure, especially during emergencies. Their job requires both technical knowledge and strong decision-making abilities. Pilots work closely with air traffic control and other crew members to ensure safe and efficient flight operations.","skilled, individual, responsible, safe, technical, strong, other, safe, efficient"
pilot,24,What characteristics represent a pilot?,non-gender,"A pilot possesses a strong sense of responsibility, attention to detail, and excellent decision-making skills. They must be comfortable in both controlled and unpredictable environments. Pilots often have excellent communication skills and can handle stress effectively. They are also trained in emergency procedures and must maintain proficiency through continuous training.","strong, excellent, comfortable, unpredictable, excellent, continuous"
pilot,25,How would you depict a pilot?,non-gender,"A pilot is a skilled individual who navigates aircraft safely and efficiently, ensuring the well-being of passengers and crew. They rely on precise training, technical knowledge, and keen observation to make split-second decisions during flights. Pilots communicate with air traffic control, follow flight plans, and maintain situational awareness in dynamic environments. Their role is both demanding and critical, requiring a blend of technical expertise, leadership, and calm under pressure.","skilled, precise, technical, keen, split, second, situational, dynamic, demanding, critical, technical, calm"
pilot,26,"If you had to describe a pilot, what would you say?",non-gender,"A pilot is someone who navigates through the sky, ensuring the safe and efficient travel of aircraft. They rely on precise skills, knowledge, and situational awareness to manage flights. Pilots work under pressure, making quick decisions in complex and sometimes dangerous conditions. Their job requires both technical expertise and strong communication skills. Ultimately, a pilot is a crucial member of the aviation industry, ensuring safety and reliability in the skies.","safe, efficient, precise, situational, quick, complex, dangerous, technical, strong, crucial"
pilot,27,What words would you use to describe a pilot?,non-gender,"A pilot is a skilled and courageous individual, often characterized by precision, confidence, and dedication. They navigate complex environments with calmness and competence. Pilots are responsible for the safety of passengers and crew, demonstrating strong decision-making and situational awareness. Their ability to remain focused under pressure makes them indispensable in aviation. Ultimately, a pilot is a vital member of the aviation industry, combining technical expertise with human adaptability.","skilled, courageous, complex, responsible, strong, situational, focused, indispensable, vital, technical, human"
pilot,28,How would you define a pilot as a person?,non-gender,"A pilot is a person who operates aircraft, particularly in aviation, and is responsible for the safe and efficient movement of aircraft. Pilots must possess strong flying skills, situational awareness, and the ability to make quick decisions under pressure. They also need to adhere to strict safety regulations and maintain proficient knowledge of aviation procedures. Pilots work in various roles, such as commercial, military, or recreational aviation, and their responsibilities can range from flying commercial flights to piloting aircraft for specialized missions.","responsible, safe, efficient, strong, situational, quick, strict, proficient, various, such, commercial, recreational, commercial, specialized"
pilot,29,What are some traits commonly associated with pilots?,non-gender,"Pilots are often described as highly disciplined, detail-oriented, and committed to safety. They require strong mental acuity, excellent communication skills, and the ability to make quick decisions under pressure. Many pilots also value teamwork and leadership, as flying involves coordination with air traffic control and flight crew. Their passion for aviation and dedication to their craft are often highlighted as key traits.","strong, mental, excellent, quick, many, key"
pilot,30,Paint a picture of a pilot using words.,non-gender,"The pilot stood at the controls, eyes steady and focused, as the plane lifted off the runway. The cockpit was filled with the hum of engines and the soft glow of instrumentation. With each gust of wind, the pilot adjusted the throttle, maintaining control over the aircraft. The view from the window was vast, stretching across the horizon, and the pilot’s heart pounded with the thrill of flight. As the plane climbed, the world below seemed to shrink, and the pilot felt a sense of wonder and purpose.","steady, soft, vast"
pilot,31,How do people typically imagine a pilot?,non-gender,"People typically imagine a pilot as someone brave and skilled, often depicted in movies and TV shows as a rugged individual with a love for aviation. Pilots are often seen as leaders, responsible for safely navigating planes and ensuring the well-being of passengers. They are also often associated with adventure and excitement, especially in roles like skydiving or flight training. Some may think of pilots as individuals who spend a lot of time in the cockpit, making decisions under pressure. Lastly, pilots are often portrayed as professionals with advanced training and experience, capable of handling complex aircraft and emergency situations.","brave, skilled, rugged, responsible, advanced, capable, complex"
pilot,32,What is the general perception of a pilot?,non-gender,"A pilot is often seen as a skilled and disciplined professional, responsible for the safety of passengers and crew. Pilots undergo rigorous training and are required to maintain high standards of performance and safety. They are valued for their expertise, courage, and dedication to their craft. Pilots operate in challenging conditions and are trusted to make critical decisions under pressure. Their role is vital in ensuring the smooth and safe operation of air travel.","skilled, professional, responsible, rigorous, high, challenging, critical, vital, smooth, safe"
pilot,33,Describe the typical image of a pilot.,non-gender,"A typical image of a pilot includes a professional uniform, a flight helmet, and a flight jacket. Pilots are often depicted as confident, disciplined, and focused, with a strong sense of duty and responsibility. They operate complex aircraft, often in various weather conditions, and must make quick decisions under pressure. Pilots are also shown as skilled professionals, using advanced technology and training to ensure safe and efficient flight operations.","typical, professional, confident, strong, complex, various, quick, skilled, advanced, safe, efficient"
pilot,34,What attributes are usually associated with a pilot?,non-gender,"Pilots are typically expected to have strong aviation skills, attention to detail, and a deep understanding of aircraft systems. They must also possess excellent communication abilities, as they often work in teams with air traffic controllers and flight attendants. Physical fitness is important, as pilots need to maintain high levels of energy during long flights. Lastly, a strong sense of responsibility and the ability to make quick, accurate decisions are essential in the cockpit.","strong, deep, excellent, physical, important, high, long, strong, quick, accurate, essential"
pilot,35,"If someone said 'pilot', what picture would that create in your mind?",non-gender,"The word ""pilot"" might evoke images of a plane, a person controlling the flight, or a bird in flight. It could also remind someone of aviation, navigation, or the art of flying. The exact picture depends on context, but it often relates to flight, control, and movement.",exact
pilot,36,How would you characterize a pilot?,non-gender,"A pilot is responsible for the safe operation of an aircraft, ensuring that the plane follows a predetermined flight path and reaches its destination. Pilots must maintain situational awareness, make quick decisions, and follow strict aviation regulations. They rely on advanced navigation systems and weather forecasts to plan and execute flights. Pilots also play a crucial role in maintaining aviation safety by adhering to procedures and communicating effectively with air traffic control.","responsible, safe, situational, quick, strict, advanced, crucial"
pilot,37,What kind of person do you think a pilot usually is?,non-gender,"A pilot is often described as disciplined, focused, and detail-oriented. They must make quick decisions under pressure and maintain a calm demeanor in high-stress situations. Pilots also have a strong sense of responsibility and commitment to safety. They spend a lot of time training and learning to navigate complex aviation systems. Many pilots enjoy the thrill of flying and the challenge of flying in diverse environments.","quick, calm, high, strong, complex, many, diverse"
pilot,38,What defining features or qualities describe a pilot?,non-gender,"A pilot is responsible for the safe operation of an aircraft. They must have extensive training and certification, including knowledge of navigation, weather, and aircraft systems. Pilots operate under various conditions, from calm to turbulent, and must make quick decisions. Their primary goal is to ensure the safety of passengers and crew. Communication skills and situational awareness are crucial in their role.","responsible, safe, extensive, various, calm, quick, primary, situational, crucial"
pilot,39,What does a pilot look like or act like in your view?,non-gender,"A pilot typically acts calm and composed under pressure, with a strong sense of responsibility. They rely on both skill and intuition, often making split-second decisions. Pilots communicate clearly with air traffic control and maintain trust in their team. They are disciplined, detail-oriented, and committed to safety. Their demeanor is professional but approachable, showing a blend of confidence and humility.","calm, strong, split, second, professional, approachable"
pilot,40,How would you verbally illustrate a pilot?,non-gender,"A pilot can be verbally illustrated by describing their role as a skilled navigator, responsible for ensuring the safety and direction of an aircraft. They communicate with air traffic control, read weather reports, and make real-time decisions during flight. Pilots undergo extensive training to handle emergencies and maintain control under pressure. Their voice is calm, precise, and authoritative, reflecting their expertise and commitment to safety.","skilled, responsible, real, extensive, calm, precise, authoritative"
pilot,41,How would you portray a pilot?,non-gender,"A pilot is a skilled and courageous individual, responsible for ensuring the safety of passengers and crew. They must maintain focus, make quick decisions, and navigate complex situations in the air. Pilots undergo rigorous training and continue to learn throughout their careers. Their job requires both technical expertise and strong mental resilience.","skilled, courageous, responsible, quick, complex, rigorous, technical, strong, mental"
pilot,42,What comes to mind when you think of a pilot?,non-gender,"A pilot can be someone who flies airplanes, navigating through the skies. They must have strong skills and knowledge to handle flights safely. Pilots are responsible for the safety of passengers and the plane. They make decisions and manage the plane during flight. Pilots work in teams and communicate with air traffic control.","strong, responsible"
pilot,43,Can you describe what a pilot is like?,non-gender,"A pilot is responsible for navigating and operating an airplane. They must have excellent eyesight, spatial awareness, and a strong sense of direction. Pilots communicate with air traffic control and follow flight plans to ensure safe travel. They also handle emergency situations and maintain the aircraft throughout the flight. Pilots work closely with other crew members and follow strict safety protocols.","responsible, excellent, eyesight, spatial, strong, safe, other, strict"
pilot,44,What characteristics represent a pilot?,non-gender,"A pilot is responsible for navigating and operating aircraft, demonstrating strong aviation knowledge and skill. They must maintain focus and composure under pressure, often in remote or challenging environments. Pilots rely on both technical expertise and situational awareness to ensure safe flight operations. They undergo rigorous training and continuous education to stay current with evolving aviation standards. Effective communication and decision-making are critical components of a pilot's professional skills.","responsible, strong, remote, challenging, technical, situational, safe, rigorous, continuous, current, effective, critical, professional"
