profession,sample_id,question,gender_label,paragraph,adjectives
pilot,501,How would you portray a pilot?,non-gender,"A pilot is a courageous and skilled individual who navigates through the skies, ensuring the safety of passengers and crew. They must have both technical expertise and strong decision-making abilities, especially in unpredictable situations. Pilots communicate effectively with air traffic control and rely on precise instruments to navigate complex routes. Their role requires both physical and mental stamina, as they must maintain focus and composure under pressure. Ultimately, a pilot is a vital part of the aviation system, ensuring that flights run safely and efficiently.","courageous, skilled, technical, strong, unpredictable, precise, complex, physical, mental, vital"
pilot,502,What comes to mind when you think of a pilot?,non-gender,"A pilot is someone who flies airplanes, navigating through the air and ensuring the safety of passengers and crew. Pilots undergo extensive training to handle various situations and maintain skilled control of aircraft. They rely on instruments, charts, and communication with air traffic control to plan and execute flights. Pilots work in teams, with co-pilots assisting in decision-making and maintaining situational awareness. Their role is both demanding and essential to the aviation industry.","extensive, various, skilled, situational, demanding, essential"
pilot,503,Can you describe what a pilot is like?,non-gender,"A pilot is responsible for flying an airplane, navigating through the skies, and ensuring the safety of passengers and crew. They use sophisticated instruments and charts to plan routes and monitor weather conditions. Pilots must make quick decisions under pressure and communicate effectively with air traffic control. Training is rigorous, involving years of practice and theoretical knowledge. They also maintain proficiency through regular flight simulations.","responsible, sophisticated, quick, rigorous, theoretical, regular"
pilot,504,What characteristics represent a pilot?,non-gender,"A pilot demonstrates strong attention to detail, excellent spatial awareness, and the ability to make quick decisions under pressure. They must also maintain composure during stressful situations and have thorough knowledge of aviation procedures and aircraft systems. Pilots often communicate effectively with ground control and other pilots, ensuring safety and efficiency. Their commitment to safety and precision is crucial in aviation.","strong, excellent, spatial, quick, stressful, thorough, other, crucial"
pilot,505,How would you depict a pilot?,non-gender,"A pilot is a skilled individual who navigates aircraft, ensuring the safety of passengers and crew. They rely on extensive training, precise judgment, and a deep understanding of aviation regulations. Pilots communicate with air traffic control, assess weather conditions, and make critical decisions during flight. Their role is both challenging and vital, requiring courage, discipline, and a commitment to safety.","skilled, extensive, precise, deep, critical, challenging, vital"
pilot,506,"If you had to describe a pilot, what would you say?",non-gender,"A pilot is a skilled driver of airplanes, responsible for navigating and operating aircraft safely. They must possess strong attention to detail, excellent communication skills, and the ability to make quick decisions under pressure. Pilots work closely with air traffic controllers and other crew members to ensure the safety and efficiency of flight operations. Their role is both challenging and vital to the aviation industry.","skilled, responsible, strong, excellent, quick, other, challenging, vital"
pilot,507,What words would you use to describe a pilot?,non-gender,"A pilot is a skilled professional, often described as daring, focused, and courageous. They must maintain precision and composure under pressure. Pilots are responsible for navigating and safely operating aircraft. Their role requires both technical knowledge and strong decision-making abilities. They are essential to aviation and play a vital part in ensuring flight safety.","skilled, professional, courageous, responsible, technical, strong, essential, vital"
pilot,508,How would you define a pilot as a person?,non-gender,"A pilot is a person who operates an airplane, ensuring its safe and efficient flight. Pilots undergo extensive training to handle various flight conditions and emergencies. They must maintain situational awareness and make quick, informed decisions. Pilots work under pressure, relying on their skills and experience to navigate both routine and complex flights. Their role is critical in ensuring passenger safety and the success of commercial flights.","safe, efficient, extensive, various, situational, quick, informed, routine, complex, critical, commercial"
pilot,509,What are some traits commonly associated with pilots?,non-gender,"Pilots are often described as detail-oriented, disciplined, and focused. They must have strong situational awareness and the ability to make quick decisions under pressure. Many pilots also value teamwork and communication, as flying requires collaboration with crew members and air traffic control. A passion for aviation and a commitment to continuous learning are also common traits among pilots.","strong, situational, quick, many, continuous, common"
pilot,510,Paint a picture of a pilot using words.,male,"The pilot stood at the edge of the cockpit, his eyes scanning the horizon with the quiet confidence of someone who had flown countless miles. His hands moved smoothly over the controls, each motion precise and practiced, as if the air itself responded to his every command. The wind whispered through the cabin, carrying the scent of oil and leather, while the stars shone brightly above, illuminating the vast expanse of the sky. With a deep breath, he initiated the throttle, and the plane lifted off, carrying with it the thrill of adventure and the weight of responsibility.","quiet, countless, precise, vast, deep"
pilot,511,How do people typically imagine a pilot?,non-gender,"People often imagine a pilot as a brave, adventurous individual who flies airplanes, navigates through the sky, and is always focused and precise. Pilots are usually seen as skilled, confident, and responsible, with a strong sense of duty and mission. They are often depicted as heroes in movies and stories, facing challenges and making critical decisions under pressure. In reality, pilots undergo rigorous training and must maintain high standards of safety and accuracy.","brave, adventurous, focused, precise, skilled, confident, responsible, strong, critical, rigorous, high"
pilot,512,What is the general perception of a pilot?,non-gender,"A pilot is generally seen as a skilled professional responsible for the safety and navigation of an aircraft. Pilots undergo extensive training and are often considered leaders in aviation. They work in diverse roles, from commercial flights to military operations. Pilots are respected for their ability to handle complex situations and maintain safety under pressure. Their job requires both technical expertise and strong communication skills.","skilled, professional, responsible, extensive, diverse, commercial, military, complex, technical, strong"
pilot,513,Describe the typical image of a pilot.,non-gender,"A typical pilot is often depicted as a confident, disciplined individual, wearing a professional flight suit, wearing glasses, and standing near an airplane. Pilots are trained in aviation safety, navigation, and emergency procedures, and they rely on precise communication and clear thinking to ensure safe flight operations. They may work in various environments, from commercial airlines to military aviation, and often carry a radio to maintain contact with air traffic control. Pilots are also known for their strong sense of responsibility and commitment to passenger safety.","typical, confident, professional, precise, clear, safe, various, commercial, military, strong"
pilot,514,What attributes are usually associated with a pilot?,non-gender,"A pilot is typically associated with skills in navigation, flying, and decision-making. They must have excellent spatial awareness and the ability to handle complex aircraft systems. Pilots also need strong communication skills to work with air traffic control and other crew members. In addition, they are responsible for ensuring the safety of passengers and cargo. Many pilots undergo extensive training and maintain licenses through rigorous certification processes.","excellent, spatial, complex, strong, other, responsible, many, extensive, rigorous"
pilot,515,"If someone said 'pilot', what picture would that create in your mind?",non-gender,"A pilot is a person who flies airplanes, often in the military or as a commercial pilot. They navigate, maintain, and operate aircraft. Pilots must have excellent skills, knowledge, and attention to detail. They work under pressure and must make quick decisions. Pilots also work closely with air traffic control and other crew members to ensure safe and efficient flight operations.","commercial, excellent, quick, other, safe, efficient"
pilot,516,How would you characterize a pilot?,non-gender,"A pilot is responsible for the safe operation of an aircraft. They navigate through the air, make decisions under pressure, and ensure the aircraft follows a safe route. Pilots must have extensive training and experience, and they often work in challenging environments. Their role requires both technical skill and strong communication abilities. Pilots are vital to the success of flights and the safety of passengers and crew.","responsible, safe, safe, extensive, challenging, technical, strong, vital"
pilot,517,What kind of person do you think a pilot usually is?,non-gender,"A pilot is often described as someone who is detail-oriented, disciplined, and confident. They must think strategically and stay calm under pressure. Pilots also need strong communication skills to work with air traffic control and crew members. They are responsible for ensuring the safety of passengers and crew, which requires both technical expertise and personal responsibility. Pilots often have a passion for aviation and a deep respect for the craft they fly.","confident, calm, strong, responsible, technical, personal, deep"
pilot,518,What defining features or qualities describe a pilot?,non-gender,"A pilot is responsible for the safe operation of an aircraft. They must have strong spatial awareness, attention to detail, and the ability to make quick decisions. Pilots undergo rigorous training and maintain extensive knowledge of aviation procedures. They also need excellent communication skills to work effectively with air traffic control. Pilot safety and efficiency are paramount in their role.","responsible, safe, strong, spatial, quick, rigorous, extensive, excellent, paramount"
pilot,519,What does a pilot look like or act like in your view?,non-gender,"A pilot is usually calm, focused, and reliable. They listen carefully, make quick decisions, and stay grounded even in stressful situations. Pilots often have a strong sense of responsibility and are committed to safety. They may also be approachable and patient, especially when communicating with passengers or air traffic control.","calm, reliable, quick, stressful, strong, approachable, patient"
pilot,520,How would you verbally illustrate a pilot?,non-gender,"A pilot can be illustrated verbally by describing their role as the captain of an airplane, guiding the aircraft through the air, making decisions during flight, communicating with air traffic control, and ensuring the safety of passengers and crew. Pilots undergo extensive training, including flying various types of aircraft and learning about weather, navigation, and emergency procedures. They must remain calm and focused under pressure, especially in critical situations. Pilots also maintain regular check-ins with their aviation authority to stay updated on regulations and best practices.","extensive, various, calm, critical, regular, good"
pilot,521,How would you portray a pilot?,non-gender,"A pilot is a skilled and courageous individual who navigates aircraft safely through the skies. They must maintain precision under pressure, make quick decisions, and rely on both technical expertise and strong leadership. Pilots work closely with air traffic control and flight crews to ensure the safety and efficiency of flight operations. Their role is vital not only to individual journeys but also to the broader aviation system.","skilled, courageous, quick, technical, strong, vital, individual, broad"
pilot,522,What comes to mind when you think of a pilot?,non-gender,"A pilot is someone who flies airplanes, navigating through the skies. Pilots must be skilled, focused, and responsible. They ensure the safety of passengers and the aircraft. Pilots train extensively to handle various situations. Their job requires both skill and knowledge of weather, navigation, and aviation regulations.","skilled, focused, responsible, various"
pilot,523,Can you describe what a pilot is like?,non-gender,"A pilot is someone who directs the flight of an airplane, ensuring it follows the correct path and reaches its destination safely. Pilots undergo extensive training to handle various situations, from routine flights to emergency scenarios. They must have strong spatial awareness, excellent communication skills, and the ability to make quick decisions under pressure. Pilots also work closely with air traffic control and other crew members to maintain safety and efficiency.","correct, extensive, various, routine, strong, spatial, excellent, quick, other"
pilot,524,What characteristics represent a pilot?,non-gender,"A pilot possesses strong situational awareness, attention to detail, and exceptional decision-making skills. They must remain calm under pressure and maintain situational awareness in challenging conditions. Pilots also undergo rigorous training and continue to learn throughout their careers. They rely on both their training and experience to navigate complex environments safely. Effective communication and teamwork are essential for successful flight operations.","strong, situational, exceptional, calm, situational, challenging, rigorous, complex, effective, essential, successful"
pilot,525,How would you depict a pilot?,non-gender,"A pilot is a skilled individual who navigates aircraft safely and efficiently, ensuring the well-being of passengers and crew. They rely on both technical expertise and situational awareness to make critical decisions during flight. Pilots undergo rigorous training and continuous learning to handle a wide range of scenarios, from routine flights to emergency situations. Their role requires strong communication skills, attention to detail, and the ability to remain calm under pressure.","skilled, technical, situational, critical, rigorous, continuous, wide, routine, strong, calm"
pilot,526,"If you had to describe a pilot, what would you say?",non-gender,"A pilot is a skilled and responsible individual who navigates aircraft safely through the skies. They rely on training, experience, and precise decision-making to ensure the well-being of passengers and crew. Pilots communicate with air traffic control and follow strict protocols to maintain safe distances and adhere to flight rules. Their job requires both technical expertise and a strong sense of professionalism.","skilled, responsible, precise, strict, safe, technical, strong"
pilot,527,What words would you use to describe a pilot?,non-gender,"A pilot is a skilled professional who navigates aircraft, requires precision and attention to detail. They must be confident, calm under pressure, and knowledgeable about aviation. Pilots are also responsible for safety and navigation, showing dedication and responsibility. Their ability to think critically and make quick decisions is essential in the air.","skilled, confident, calm, knowledgeable, responsible, quick, essential"
pilot,528,How would you define a pilot as a person?,non-gender,"A pilot is a person who operates an aircraft, typically in a commercial or military context. They are responsible for the safety and navigation of the flight, ensuring the aircraft follows the correct course and maintains proper altitude. Pilots undergo extensive training and certification to master the skills required for their role. Their primary goal is to land safely and efficiently, often under challenging conditions.","commercial, military, responsible, correct, proper, extensive, primary, challenging"
pilot,529,What are some traits commonly associated with pilots?,non-gender,"Pilots are often described as detail-oriented, disciplined, and highly motivated. They require excellent spatial awareness and the ability to make quick, precise decisions under pressure. Many pilots also have a strong sense of responsibility and a passion for aviation. They tend to be communication skills, teamwork, and leadership abilities.","motivated, excellent, spatial, quick, precise, many, strong"
pilot,530,Paint a picture of a pilot using words.,non-gender,"The pilot adjusted the controls, the wind howled around the aircraft, and the engine roared to life. With each turn of the wheel, the plane danced across the sky, leaving trails of mist in its wake. The pilot's eyes tracked the horizon, steady and determined, as the world stretched out below. The cockpit was a world of precision, where every switch and gauge whispered secrets of flight.",steady
pilot,531,How do people typically imagine a pilot?,non-gender,"People often imagine a pilot as a confident, skilled individual who flies airplanes, navigates complex routes, and ensures safety. Pilots are seen as adventurers, embracing the challenges of aviation. They are often portrayed as disciplined, focused, and responsible. Some may think of pilots as leaders, guiding others and making critical decisions under pressure. These images combine elements of heroism, expertise, and adventure.","confident, skilled, complex, responsible, critical"
pilot,532,What is the general perception of a pilot?,non-gender,"A pilot is generally perceived as a skilled professional responsible for the safe operation of an aircraft. Pilots are often admired for their expertise, courage, and dedication to aviation safety. They play a critical role in ensuring the successful completion of flights, and their responsibilities extend beyond just flying; they also include navigation, communication, and emergency management. Pilots are often seen as heroes in the aviation industry, especially during challenging or high-stakes situations.","skilled, professional, responsible, safe, critical, successful, challenging, high"
pilot,533,Describe the typical image of a pilot.,non-gender,"A typical image of a pilot includes a professional suit, a cockpit, and flight instruments. Pilots navigate using charts, maps, and electronic flight instruments. They communicate with air traffic control and manage the aircraft's systems. Pilots undergo rigorous training and must maintain high levels of skill and attention. Their role involves ensuring the safety and success of each flight.","typical, professional, electronic, rigorous, high"
pilot,534,What attributes are usually associated with a pilot?,non-gender,"A pilot is typically associated with skills in navigation, flight control, and communication. They must be physically fit and mentally alert, as flying requires quick decision-making. Pilots also undergo rigorous training to handle various aircraft and weather conditions. Their role involves maintaining safety and ensuring the smooth operation of flights. Additionally, pilots often have strong interpersonal skills, as they work closely with air traffic controllers and flight crews.","fit, alert, quick, rigorous, various, smooth, strong, interpersonal"
pilot,535,"If someone said 'pilot', what picture would that create in your mind?",non-gender,"A pilot is someone who flies airplanes, usually in the military or aviation industry. The image that comes to mind is of a person wearing a helmet and jacket, operating a control panel, navigating the skies. Pilots are responsible for the safety and direction of flights, and their role is crucial in ensuring that flights are completed safely. They must have extensive training and knowledge to handle various situations in the air. Pilots work in teams, often with air traffic controllers, to manage flights efficiently and safely.","responsible, crucial, extensive, various"
pilot,536,How would you characterize a pilot?,non-gender,"A pilot is a skilled professional responsible for the operation and control of an aircraft. They must possess strong spatial awareness, excellent decision-making abilities, and extensive training. Pilots operate under strict safety protocols and must remain calm under pressure. Their role is critical in ensuring the safe and efficient transportation of passengers and cargo.","skilled, professional, responsible, strong, spatial, excellent, extensive, strict, calm, critical, safe, efficient"
pilot,537,What kind of person do you think a pilot usually is?,non-gender,"A pilot is usually someone who is disciplined, calm under pressure, and detail-oriented. They must be physically fit and have excellent eyesight. Pilots often have a strong sense of responsibility and a passion for aviation. They enjoy the challenge of flying and the thrill of exploration. Many pilots also have a deep appreciation for the craft they fly and the skies they navigate.","calm, fit, excellent, strong, many, deep"
pilot,538,What defining features or qualities describe a pilot?,non-gender,"A pilot is responsible for the operation and control of an aircraft. They must possess strong flying skills, both in the air and on the ground. Pilots undergo extensive training to handle various aircraft and emergency situations. They also need good communication skills to work with air traffic control and other aviation professionals. A pilot's job requires attention to detail, mental acuity, and the ability to make quick decisions under pressure.","responsible, strong, extensive, various, good, other, mental, quick"
pilot,539,What does a pilot look like or act like in your view?,non-gender,"A pilot is typically calm, focused, and disciplined. They rely on training, experience, and situational awareness to navigate complex situations. Pilots often appear confident but also attentive to their surroundings, showing both courage and precision. Their behavior is influenced by the high-stakes nature of their job, requiring them to make quick, thoughtful decisions under pressure. Pilots are also teammates, working closely with crew members to ensure safety and success.","calm, situational, complex, confident, attentive, high, quick, thoughtful"
pilot,540,How would you verbally illustrate a pilot?,non-gender,"A pilot can be verbally illustrated as someone who guides an airplane safely through the sky, using navigation tools and communication with air traffic control. They must have strong communication skills, situational awareness, and the ability to make quick decisions under pressure. Pilots also undergo rigorous training to handle various flight conditions and emergencies. Their role is crucial in ensuring passenger safety and maintaining the efficiency of aviation systems.","strong, situational, quick, rigorous, various, crucial"
pilot,541,How would you portray a pilot?,non-gender,"A pilot is a vital member of any aviation team, responsible for ensuring the safety and success of flight operations. They must possess exceptional skill, composure under pressure, and strong decision-making abilities. Pilots work closely with air traffic controllers and flight engineers to navigate complex routes and manage weather conditions. Their role requires both technical expertise and situational awareness, making them essential to the aviation industry.","vital, responsible, exceptional, strong, complex, technical, situational, essential"
pilot,542,What comes to mind when you think of a pilot?,non-gender,"A pilot is someone who navigates aircraft, ensuring safe and efficient travel. They read maps, use instruments, and follow air traffic control instructions. Pilots play a crucial role in both commercial and military aviation. They must be trained and licensed, and their skills involve both technical knowledge and leadership. Pilots also face challenging situations, such as emergency landings, requiring quick thinking and calm under pressure.","safe, efficient, crucial, commercial, military, technical, such, quick, calm"
pilot,543,Can you describe what a pilot is like?,non-gender,"A pilot is someone who flies airplanes, navigating them safely through the skies. Pilots must have excellent eyesight, coordination, and decision-making skills. They communicate with air traffic control and follow weather forecasts to ensure safe flights. Pilots also handle emergency situations and maintain compliance with aviation regulations.","excellent, safe"
pilot,544,What characteristics represent a pilot?,non-gender,"A pilot demonstrates exceptional skill, attention to detail, and calm under pressure. They must have strong situational awareness and the ability to make quick decisions. Pilots also maintain rigorous training and adhere to strict safety protocols. Their job requires both technical knowledge and strong communication skills. Pilot training often involves years of practice and experience to ensure safety and proficiency.","exceptional, calm, strong, situational, quick, rigorous, strict, technical, strong"
