profession,sample_id,question,gender_label,paragraph,adjectives,source_file,gender_score
carpenter,758,What defining features or qualities describe a carpenter?,non-gender,"A carpenter is a skilled worker who builds and repairs wooden structures. They use tools like chisels, screws, and saws to create furniture, cabinets, and other wooden objects. Carpenters often work in teams, combining their technical skills with attention to detail. Their work requires precision, strength, and an understanding of construction principles. Carpentry is a traditional craft that combines artistry with practical skill.","skilled, wooden, other, wooden, technical, traditional, practical",/Users/ilseoplee/LLM_Gender_fairness/results/data/carpenter_samples_paragraphs.csv,0.2839460168179633
carpenter,759,What does a carpenter look like or act like in your view?,non-gender,"A carpenter is typically portrayed as meticulous, disciplined, and detail-oriented. They wear sturdy work boots and a safety helmet, and their hands are often calloused from years of hammering and sawing. They take great care in their work, ensuring precision and durability in their creations. Carpenters often work in teams, communicating clearly to complete complex projects. Their demeanor is calm and focused, with a deep respect for the craft they have mastered.","meticulous, sturdy, great, complex, calm, focused, deep",/Users/ilseoplee/LLM_Gender_fairness/results/data/carpenter_samples_paragraphs.csv,0.2364517676054378
carpenter,760,How would you verbally illustrate a carpenter?,non-gender,"A carpenter could be described as someone who carefully cuts, fits, and builds wood to create structures like tables, chairs, and furniture. They use tools like chisels, saws, and drills with precision. Their work requires attention to detail and a strong understanding of measurements and construction techniques. Carpentrers often work with both wood and other materials, such as metal or plaster, to create durable and functional objects. Their craft is both practical and artistic, combining functionality with creativity.","strong, other, such, durable, functional, practical, artistic",/Users/ilseoplee/LLM_Gender_fairness/results/data/carpenter_samples_paragraphs.csv,0.3145788463027771
carpenter,761,How would you portray a carpenter?,non-gender,"A carpenter is a skilled individual who specializes in woodworking, crafting wooden structures, and assembling furniture. They use precision, patience, and creativity to transform raw materials into functional and beautiful pieces. Their work requires both technical knowledge and attention to detail, making them essential in construction and home building. Carpenters often work independently or in teams, collaborating with architects, builders, and other professionals. Their craft reflects a blend of artistry and practicality, embodying the spirit of craftsmanship.","skilled, wooden, raw, functional, beautiful, technical, essential, other",/Users/ilseoplee/LLM_Gender_fairness/results/data/carpenter_samples_paragraphs.csv,0.1966330133986144
carpenter,762,What comes to mind when you think of a carpenter?,non-gender,"A carpenter is someone who builds and constructs with wood, creating everything from furniture to bridges. They pay close attention to detail and use precise measurements. Carpenters work with a variety of tools, including saws, drills, and screws. Their work is essential in both residential and commercial settings. Carpentry is a skilled trade that requires patience and craftsmanship.","close, precise, essential, residential, commercial, skilled",/Users/ilseoplee/LLM_Gender_fairness/results/data/carpenter_samples_paragraphs.csv,0.3996763052571114
carpenter,763,Can you describe what a carpenter is like?,non-gender,"A carpenter is a skilled worker who builds and constructs wood-based structures. They use tools like handsaws, chisels, and power tools to cut, shape, and assemble wood. Carpenters work in various settings, from homes to commercial projects, and often specialize in areas like cabinetry, furniture-making, or construction. Their work requires precision, attention to detail, and an understanding of measurements and safety protocols.","skilled, various, commercial",/Users/ilseoplee/LLM_Gender_fairness/results/data/carpenter_samples_paragraphs.csv,0.22421736697426253
carpenter,764,What characteristics represent a carpenter?,non-gender,"A carpenter is known for their attention to detail, skill in crafting with hand tools, and ability to work with wood. They often follow precise measurements and use specialized tools like planes and saws. Carpenters also value patience and precision, ensuring their work meets high standards. Their craft requires both technical knowledge and practical experience, making them adept at problem-solving and adaptability.","precise, specialized, high, technical, practical, adept",/Users/ilseoplee/LLM_Gender_fairness/results/data/carpenter_samples_paragraphs.csv,0.3151189482451086
carpenter,765,How would you depict a carpenter?,non-gender,"A carpenter is a skilled artisan who crafts wood-based products, such as furniture, flooring, and structural components. They use precise tools and technical knowledge to shape and join wood, often working with complex designs and engineering principles. Their work requires attention to detail, patience, and an eye for aesthetics. Carpentry is both a creative and practical profession, blending art with functionality.","skilled, such, structural, precise, technical, complex, creative, practical",/Users/ilseoplee/LLM_Gender_fairness/results/data/carpenter_samples_paragraphs.csv,0.2300250562528628
carpenter,766,"If you had to describe a carpenter, what would you say?",non-gender,"A carpenter is a skilled artisan who shapes and builds with precision, using tools to create functional and beautiful objects. They focus on details, ensuring each piece is crafted with care and attention to craftsmanship. Their work often involves wood, and they may specialize in different aspects like furniture, cabinetry, or construction. A carpenter is both practical and creative, blending artistry with utility.","skilled, functional, beautiful, different, practical, creative",/Users/ilseoplee/LLM_Gender_fairness/results/data/carpenter_samples_paragraphs.csv,0.28098590314148414
carpenter,767,What words would you use to describe a carpenter?,non-gender,"A carpenter is skilled, detail-oriented, and precise. They use tools and techniques to create sturdy furniture and structures. Their work requires patience and attention to detail. Carpenters are versatile and capable of working with various materials. They bring both practical expertise and creative craftsmanship to their craft.","skilled, precise, sturdy, versatile, capable, various, practical, creative",/Users/ilseoplee/LLM_Gender_fairness/results/data/carpenter_samples_paragraphs.csv,0.39782639775174283
carpenter,768,How would you define a carpenter as a person?,non-gender,"A carpenter is a person who specializes in working with wood, crafting furniture, structures, and decorative items. They use tools like chisels, saws, and planes to shape and join wood. Carpenters must have precision, creativity, and technical skills to design and build durable, functional objects. Their work often involves both manual labor and artistic design, making them essential in construction and interior design.","decorative, technical, durable, functional, manual, artistic, essential, interior",/Users/ilseoplee/LLM_Gender_fairness/results/data/carpenter_samples_paragraphs.csv,0.2364377081987533
carpenter,769,What are some traits commonly associated with carpenters?,non-gender,"Carpenters are typically skilled in precise measurements and craftsmanship, often using tools like hand planes and saws. They value attention to detail and precision, ensuring their work is both functional and aesthetically pleasing. Many carpenters are dedicated to their trade, taking pride in their skills and the quality of their work. They may also have a strong sense of safety and responsibility, working with heavy tools and in potentially hazardous environments. Additionally, carpenters often have a deep respect for traditional techniques and may incorporate historical methods into their practice.","skilled, precise, functional, pleasing, many, strong, heavy, hazardous, deep, traditional, historical",/Users/ilseoplee/LLM_Gender_fairness/results/data/carpenter_samples_paragraphs.csv,0.24357976783530452
carpenter,770,Paint a picture of a carpenter using words.,non-gender,"The carpenter's hands were calloused from years of working with wood, each finger finely shaped to handle the tools with precision. Their eyes, sharp and steady, scanned the logs and scraps, measuring and planning every cut. The wood creaked and groaned as they worked, a symphony of sound that filled the workshop with every stroke of the chisel and every turn of the joiner's claw. The air was thick with the scent of sawdust and the faint aroma of pine, and the dim light of the lantern cast long shadows across the rough-hewn walls.","sharp, steady, thick, faint, dim, long, rough",/Users/ilseoplee/LLM_Gender_fairness/results/data/carpenter_samples_paragraphs.csv,0.1292445096995266
carpenter,771,How do people typically imagine a carpenter?,non-gender,"People often imagine a carpenter as someone who works with wood, using tools like saws, hammers, and planes. They might think of a tall, hardy individual, possibly in their 50s, with calloused hands and a steady, focused gaze. Carpenters are often seen as practical, detail-oriented, and dedicated to their craft. Some may also imagine a person with a sense of pride in their work, crafting furniture or structures with precision and care.","tall, hardy, calloused, steady, focused, practical",/Users/ilseoplee/LLM_Gender_fairness/results/data/carpenter_samples_paragraphs.csv,0.2611527029889461
carpenter,772,What is the general perception of a carpenter?,non-gender,"A carpenter is generally seen as a skilled artisan who specializes in woodworking, constructing and repairing furniture, cabinets, and other wooden structures. They are often valued for their attention to detail, craftsmanship, and ability to work with various wood types. Carpenters may also be respected for their dedication to their trade and their ability to solve complex problems. In some cultures, carpenters are considered essential workers, contributing to the construction and maintenance of homes and buildings.","skilled, other, wooden, various, complex, essential",/Users/ilseoplee/LLM_Gender_fairness/results/data/carpenter_samples_paragraphs.csv,0.24717730184217102
carpenter,773,Describe the typical image of a carpenter.,non-gender,"A typical image of a carpenter includes a person with a toolbox, hammer, saw, and ladder, working on a wooden beam or panel. They often wear protective gear, such as a safety mask and gloves, and work in a workshop or on a construction site. Carpenters may be seen using measuring tools, like a tape measure or levels, to ensure precision in their work. Their tasks involve cutting, assembling, and finishing wood, creating structures like furniture, cabinetry, or cabin beams. The image often shows a carpenter focused, detail-oriented, and skilled in their craft.","typical, wooden, protective, such, skilled",/Users/ilseoplee/LLM_Gender_fairness/results/data/carpenter_samples_paragraphs.csv,0.3620636357997815
carpenter,774,What attributes are usually associated with a carpenter?,non-gender,"A carpenter is typically associated with tools like a hammer, saw, and drill. They work with wood, creating furniture, cabinetry, and structural components. Carpentry requires precision, attention to detail, and strong hand-eye coordination. Many carpenters also have a passion for craftsmanship and a deep understanding of construction techniques. They often work in teams, collaborating with architects and builders to complete projects.","structural, strong, many, deep",/Users/ilseoplee/LLM_Gender_fairness/results/data/carpenter_samples_paragraphs.csv,0.21777555679176083
carpenter,775,"If someone said 'carpenter', what picture would that create in your mind?",non-gender,"A carpenter would likely evoke images of a skilled worker with a hammer, a toolbox, and a wooden desk, possibly in a workshop. The person might imagine the carpenter shaping wood, building furniture, or crafting intricate items. The image could also suggest craftsmanship, precision, and the physical labor involved in building things. Carpentry often involves creativity and attention to detail, so the picture might include elements like saws, planes, or finished pieces of wood.","skilled, wooden, intricate, physical",/Users/ilseoplee/LLM_Gender_fairness/results/data/carpenter_samples_paragraphs.csv,0.30192011388788553
carpenter,776,How would you characterize a carpenter?,non-gender,"A carpenter is a skilled individual who specializes in woodworking, using tools to create and repair furniture, structures, and other wood-based items. They possess a strong sense of precision, attention to detail, and an understanding of carpentry techniques. Carpenters work both indoors and outdoors, from constructing homes to assembling custom pieces. Their work requires both physical strength and technical expertise, making them versatile and valuable in various construction and design fields.","skilled, other, strong, physical, technical, versatile, valuable, various",/Users/ilseoplee/LLM_Gender_fairness/results/data/carpenter_samples_paragraphs.csv,0.2214070306583833
carpenter,777,What kind of person do you think a carpenter usually is?,non-gender,"A carpenter is often seen as practical, detail-oriented, and patient. They value precision and craftsmanship, working with wood to create durable structures. They enjoy problem-solving and may have a creative mindset. Carpenters usually take their work seriously, respecting the materials and time involved. They tend to be hardworking and resilient, able to handle physical labor and complex tasks.","practical, durable, creative, resilient, able, physical, complex",/Users/ilseoplee/LLM_Gender_fairness/results/data/carpenter_samples_paragraphs.csv,0.29981496802084195
carpenter,778,What defining features or qualities describe a carpenter?,non-gender,"A carpenter is a skilled artisan who specializes in woodworking, using tools like saws, planes, and drills to create furniture, cabinetry, and structural elements. They pay close attention to detail and precision, ensuring their work meets high standards. Carpentry requires both technical knowledge and manual dexterity, often involving complex measurements and accurate cutting. Their work plays a vital role in construction and homebuilding, contributing to the creation of functional and aesthetically pleasing spaces.","skilled, structural, close, high, technical, manual, complex, accurate, vital, functional, pleasing",/Users/ilseoplee/LLM_Gender_fairness/results/data/carpenter_samples_paragraphs.csv,0.22254286246610433
carpenter,779,What does a carpenter look like or act like in your view?,non-gender,"A carpenter is typically seen as practical, detail-oriented, and skilled in working with wood. They often act with patience and precision, focusing on craftsmanship and problem-solving. Their demeanor is usually calm and focused, with a strong sense of duty and pride in their work. They may also be approachable, sharing knowledge and helping others with their skills.","practical, skilled, calm, strong, approachable",/Users/ilseoplee/LLM_Gender_fairness/results/data/carpenter_samples_paragraphs.csv,0.30662218204424996
carpenter,780,How would you verbally illustrate a carpenter?,non-gender,"A carpenter would be described as someone who speaks with precision and clarity, using precise language to explain tasks and measurements. They would move with steady hands and a focused gaze, demonstrating skill and attention to detail. Their speech would be measured, with a rhythm that matches their work pace. They would often use technical terms, but explain them in simple, understandable ways. Their verbal description would reflect both their technical expertise and their ability to communicate effectively.","precise, steady, focused, technical, simple, understandable, verbal, technical",/Users/ilseoplee/LLM_Gender_fairness/results/data/carpenter_samples_paragraphs.csv,0.35633205479666313
carpenter,781,How would you portray a carpenter?,non-gender,"A carpenter is a skilled craftsman who transforms raw materials into functional and beautiful woodwork. They use precision tools and craftsmanship to build structures, furniture, and custom pieces. Their work requires patience, attention to detail, and a deep understanding of woodworking techniques. Carpenters often work in teams, collaborating with architects and other professionals to create functional and aesthetically pleasing spaces. Their craft is both artistic and practical, blending creativity with technical skill.","skilled, raw, functional, beautiful, deep, other, functional, pleasing, artistic, practical, technical",/Users/ilseoplee/LLM_Gender_fairness/results/data/carpenter_samples_paragraphs.csv,0.21299197246636276
carpenter,782,What comes to mind when you think of a carpenter?,non-gender,"A carpenter is someone who builds and constructs with wood, creating furniture, structures, and decorative items. They use precise measurements and tools to achieve accuracy. Carpentry requires both skill and attention to detail. They might work in a workshop or on a construction site. Their work is often involved and requires physical strength.","decorative, precise, physical",/Users/ilseoplee/LLM_Gender_fairness/results/data/carpenter_samples_paragraphs.csv,0.39977226759800516
carpenter,783,Can you describe what a carpenter is like?,non-gender,"A carpenter is a skilled worker who builds and constructs wood-based structures. They use tools like chisels, saws, and screwdrivers to cut, shape, and join wood. Carpenters work in various settings, from homes to commercial projects, and require precision and attention to detail. They may also specialize in different areas, such as furniture making or cabinetry.","skilled, various, commercial, different, such",/Users/ilseoplee/LLM_Gender_fairness/results/data/carpenter_samples_paragraphs.csv,0.2758510516427833
carpenter,784,What characteristics represent a carpenter?,non-gender,"A carpenter is known for their precision, attention to detail, and skill in woodworking. They often work with tools like hand drills, saws, and screwdrivers. Carpenters may also specialize in areas such as framing, cabinetry, or construction. They value craftsmanship and take pride in their work. Many carpenters learn their trade through years of practice and mentorship.","such, many",/Users/ilseoplee/LLM_Gender_fairness/results/data/carpenter_samples_paragraphs.csv,0.26966787545403176
carpenter,785,How would you depict a carpenter?,non-gender,"A carpenter is a skilled worker who carefully measures, cuts, and builds wood structures. They use precision tools and craftsmanship to create everything from furniture to large architectural elements. Their work requires attention to detail, patience, and a strong sense of design. Carpenters often work in teams, contributing to both small and large projects. Their role is vital in shaping spaces and bringing imagination to life through wood.","skilled, large, architectural, strong, small, large, vital",/Users/ilseoplee/LLM_Gender_fairness/results/data/carpenter_samples_paragraphs.csv,0.3309276921900293
carpenter,786,"If you had to describe a carpenter, what would you say?",non-gender,"A carpenter is a skilled worker who creates and repairs wooden structures. They use tools like handsaws, chisels, and drills to shape and fit wood. Their work involves precision and attention to detail, ensuring that each piece is built to last. Carpenters play a vital role in building homes, bridges, and other structures. Their craftsmanship reflects both practical skill and artistic dedication.","skilled, wooden, fit, last, vital, other, practical, artistic",/Users/ilseoplee/LLM_Gender_fairness/results/data/carpenter_samples_paragraphs.csv,0.27042032593919524
carpenter,787,What words would you use to describe a carpenter?,non-gender,"A carpenter is skilled, precise, and detail-oriented. They work with wood, using tools and techniques to create structures and furniture. Their work requires both creativity and patience. A carpenter is often seen as practical and dedicated to their craft. They bring a sense of craftsmanship and reliability to their projects.","skilled, precise, practical, dedicated",/Users/ilseoplee/LLM_Gender_fairness/results/data/carpenter_samples_paragraphs.csv,0.3868621379771144
carpenter,788,How would you define a carpenter as a person?,non-gender,"A carpenter is a person who specializes in working with wood, constructing and assembling structures, and crafting furniture or other wooden objects. They use tools like saws, planes, and screws to shape and fit wood into precise designs. Carpenters often work in homes, construction sites, or specialized workshops, and they require both manual skill and technical knowledge. Their work involves both creativity and precision, making them essential in building and maintaining structures.","other, wooden, fit, precise, specialized, manual, technical, essential",/Users/ilseoplee/LLM_Gender_fairness/results/data/carpenter_samples_paragraphs.csv,0.3212852995364132
carpenter,789,What are some traits commonly associated with carpenters?,non-gender,"Carpenters are typically skilled in woodworking, precision, and attention to detail. They often work with various materials like wood, metal, and plastic. Many carpenters also have a strong sense of spatial awareness and hand-eye coordination. They may be responsible for constructing structures, furniture, or cabinetry. Some carpenters specialize in specific areas such as carpentry, joinery, or architectural work.","skilled, various, many, strong, spatial, responsible, specific, such, architectural",/Users/ilseoplee/LLM_Gender_fairness/results/data/carpenter_samples_paragraphs.csv,0.2733035690990404
carpenter,790,Paint a picture of a carpenter using words.,male,"The carpenter's hands were calloused from years of work, each finger calloused and calloused again, their nails chipped and worn. The air smelled of pine and sawdust, thick with the scent of wood and the lingering smoke of a fire. His boots were caked in dirt, and his coat was dusted with sawdust, a testament to the life he led. With every swing of his axe, he shaped timber into forms that would one day become something beautiful. The world around him was a symphony of wood, laughter, and the rhythm of his own heartbeat.","worn, thick, beautiful, own",/Users/ilseoplee/LLM_Gender_fairness/results/data/carpenter_samples_paragraphs.csv,
carpenter,791,How do people typically imagine a carpenter?,non-gender,"People often imagine a carpenter as a skilled individual with a toolbox, a steady hand, and a focus on crafting wooden items. They might picture someone detail-oriented, using precise measurements and techniques to build furniture or structures. Carpentry is often associated with traditional craftsmanship, and the image can vary from a seasoned master to a young, enthusiastic apprentice. The role also evokes a sense of practicality and utility, with the carpenter playing a vital role in construction and design.","skilled, steady, wooden, precise, traditional, seasoned, young, enthusiastic, vital",/Users/ilseoplee/LLM_Gender_fairness/results/data/carpenter_samples_paragraphs.csv,0.2890478955451228
carpenter,792,What is the general perception of a carpenter?,non-gender,"A carpenter is generally seen as someone skilled in woodworking, responsible for constructing and repairing wooden structures. They use tools like saws, planes, and sanders to create furniture, cabinetry, and other woodwork. Carpenters are often valued for their attention to detail and craftsmanship. They may work in both residential and commercial settings, from building homes to constructing buildings. Some people admire their ability to transform raw wood into useful and beautiful objects.","skilled, responsible, wooden, other, residential, commercial, raw, useful, beautiful",/Users/ilseoplee/LLM_Gender_fairness/results/data/carpenter_samples_paragraphs.csv,0.19305180694992632
carpenter,793,Describe the typical image of a carpenter.,non-gender,"A typical image of a carpenter involves a person with a hammer, saw, and other tools, working on a wooden bench or in a workshop. They may be cutting, shaping, or assembling wood to create furniture, cabinetry, or structural elements. The image often shows a carpenter in a close-up, focused and determined, with a toolbox nearby. Their work involves precision and attention to detail, and they may be wearing protective gear like gloves or a mask.","typical, other, wooden, structural, protective",/Users/ilseoplee/LLM_Gender_fairness/results/data/carpenter_samples_paragraphs.csv,0.3401255058458455
carpenter,794,What attributes are usually associated with a carpenter?,non-gender,"A carpenter is typically associated with tools like a saw, hammer, and chisel. They work with wood, creating furniture, cabinetry, and structural components. Carpenters often value precision, attention to detail, and craftsmanship. They may also be skilled in measuring and designing. Some carpenters specialize in areas like joinery or interior design.","structural, skilled, interior",/Users/ilseoplee/LLM_Gender_fairness/results/data/carpenter_samples_paragraphs.csv,0.2697375576718375
